{
  "$schema": "../schema-v2.json",
  "baseline": {
    "metrics": {
      "classification": "exact-static-counts-used-as-context-proxies",
      "directReferenceCount": 1,
      "directReferences": [
        "references/updating.md"
      ],
      "estimatedTokens": {
        "classification": "estimate",
        "comparisonScope": "same-English-Markdown-surface-only",
        "method": "ceil(utf8-bytes/4)",
        "value": 1475
      },
      "logicalLines": 107,
      "utf8Bytes": 5899,
      "whitespaceDelimitedWords": 757
    },
    "release": {
      "commit": "4c24ba6c016945038778475ce6b69ac9e9a5ce3b",
      "tag": "v0.7.9",
      "tree": "719622eff9654dd1050863213d2bf81d3455d6f6",
      "version": "0.7.9"
    },
    "sha256": "1380155863715c28b91223823f3eaadb96bcefbe2482b444ef9dc8e8b62fe011"
  },
  "candidate": {
    "metrics": {
      "classification": "exact-static-counts-used-as-context-proxies",
      "utf8Bytes": 7226,
      "whitespaceDelimitedWords": 878,
      "logicalLines": 77,
      "directReferenceCount": 2,
      "directReferences": [
        "references/credential-lifecycle.md",
        "references/updating.md"
      ],
      "estimatedTokens": {
        "classification": "estimate",
        "method": "ceil(utf8-bytes/4)",
        "comparisonScope": "same-English-Markdown-surface-only",
        "value": 1807
      }
    },
    "sha256": "dda9b2a030ae7216a86aa1021d10a4d717623617ee2bf8a460265c824398c86d"
  },
  "comparison": {
    "method": "same-English-Markdown-surface",
    "utf8ByteDelta": 1327,
    "absoluteThresholdReached": true,
    "relativeThresholdReached": true,
    "meaningfulIncrease": true,
    "reviewStatus": "reviewed",
    "wordDelta": 121,
    "lineDelta": -30,
    "referenceDelta": 1,
    "estimatedTokenDelta": 332,
    "justification": "The cumulative 1327-byte increase over v0.7.9 retains explicit route ownership, consent, authorization, independent external and persistent-change gates, fail-closed resume, credential lifecycle routing, and optional invocation guidance. Those cross-route decisions belong at startup; detailed protocols remain on demand. This version adds 160 bytes over the 7066-byte v0.15.0 gate: the gate's description states its explicit-invocation condition, its lifecycle rule treats a fork as a resume, the delegate-simple-task entry names the host's verified top reasoning level and a permission-bypass mode, and the host-neutral optimize-agent-usage entry names credits, tokens, and context, while host-specific detail stays in route references. The gate remains 146 bytes below the 7372-byte maximum. No reduction or new host observation is claimed."
  },
  "hostMetrics": [
    {
      "cachedInputTokens": null,
      "credits": null,
      "exactUsageExposed": false,
      "host": "codex",
      "inputTokens": null,
      "reason": "Current Codex host, usage and lifecycle observation remain NOT-RUN; prior no-Hook observations bind their original runtime only.",
      "status": "not-run",
      "wallClockMilliseconds": null
    },
    {
      "cachedInputTokens": null,
      "credits": null,
      "exactUsageExposed": false,
      "host": "claude-code",
      "inputTokens": null,
      "reason": "Current Claude Code host, usage and lifecycle observation remain NOT-RUN; the Claude Code plugin delivers the same routing gate as the Codex plugin.",
      "status": "not-run",
      "wallClockMilliseconds": null
    }
  ],
  "measurementBoundary": {
    "estimatedTokens": "estimate",
    "exactHostUsage": "not-run",
    "modelOrReasoningChanged": false,
    "networkOrTelemetryUsed": false,
    "staticCounts": "proxy",
    "volatilePricingIncluded": false
  },
  "recordId": "routing-context-budget-v0-16-0",
  "reviewThreshold": {
    "absoluteUtf8Bytes": 256,
    "comparison": "cumulative-from-immutable-baseline",
    "effect": "review-and-justify-not-automatic-rejection",
    "operator": "either",
    "relativeBasisPoints": 500
  },
  "routingQuality": {
    "reductionExperiment": null,
    "reductionPolicy": {
      "requiredForAnyReduction": true,
      "requiredResults": [
        "routing",
        "no-route"
      ],
      "requiredStatus": "pass",
      "sameWorkloadRequired": true,
      "staticAndHostEvidenceRemainDistinct": true
    },
    "workload": {
      "classification": "static-contract-workload-identity",
      "path": "evals/routing",
      "fileCount": 12,
      "caseCount": 95,
      "routedCaseCount": 69,
      "noRouteCaseCount": 26,
      "sha256": "91398945f0760e5ca49587c429751a16b6a78c5cf339f9a09867569793f60ab9"
    }
  },
  "scenarios": [
    {
      "compactionMode": "not-applicable",
      "expectationSource": "checked-in-hook-contract-not-host-observation",
      "expectedInjectionCount": 1,
      "hostObservations": [
        {
          "duplicateInjectionDetected": null,
          "host": "codex",
          "injections": [],
          "observedInjectionCount": null,
          "reason": "Current lifecycle behavior is unobserved; the scenario remains a declared expectation for this candidate.",
          "status": "not-run"
        },
        {
          "duplicateInjectionDetected": null,
          "host": "claude-code",
          "injections": [],
          "observedInjectionCount": null,
          "reason": "Current Claude Code lifecycle behavior is unobserved; the scenario remains a declared expectation for this release.",
          "status": "not-run"
        }
      ],
      "id": "fresh-startup-no-route",
      "lifecycleSource": "startup",
      "requestCaseIds": [
        "no-route-readme-summary-001"
      ],
      "sessionState": "fresh"
    },
    {
      "compactionMode": "not-applicable",
      "expectationSource": "checked-in-hook-contract-not-host-observation",
      "expectedInjectionCount": 1,
      "hostObservations": [
        {
          "duplicateInjectionDetected": null,
          "host": "codex",
          "injections": [],
          "observedInjectionCount": null,
          "reason": "Current lifecycle behavior is unobserved; the scenario remains a declared expectation for this candidate.",
          "status": "not-run"
        },
        {
          "duplicateInjectionDetected": null,
          "host": "claude-code",
          "injections": [],
          "observedInjectionCount": null,
          "reason": "Current Claude Code lifecycle behavior is unobserved; the scenario remains a declared expectation for this release.",
          "status": "not-run"
        }
      ],
      "id": "fresh-startup-routed",
      "lifecycleSource": "startup",
      "requestCaseIds": [
        "review-axiom-task-observable-refusal-001"
      ],
      "sessionState": "fresh"
    },
    {
      "compactionMode": "not-applicable",
      "expectationSource": "checked-in-hook-contract-not-host-observation",
      "expectedInjectionCount": 1,
      "hostObservations": [
        {
          "duplicateInjectionDetected": null,
          "host": "codex",
          "injections": [],
          "observedInjectionCount": null,
          "reason": "Current lifecycle behavior is unobserved; the scenario remains a declared expectation for this candidate.",
          "status": "not-run"
        },
        {
          "duplicateInjectionDetected": null,
          "host": "claude-code",
          "injections": [],
          "observedInjectionCount": null,
          "reason": "Current Claude Code lifecycle behavior is unobserved; the scenario remains a declared expectation for this release.",
          "status": "not-run"
        }
      ],
      "id": "resume-no-route",
      "lifecycleSource": "resume",
      "requestCaseIds": [
        "no-route-readme-summary-001"
      ],
      "sessionState": "resumed"
    },
    {
      "compactionMode": "not-applicable",
      "expectationSource": "checked-in-hook-contract-not-host-observation",
      "expectedInjectionCount": 1,
      "hostObservations": [
        {
          "duplicateInjectionDetected": null,
          "host": "codex",
          "injections": [],
          "observedInjectionCount": null,
          "reason": "Current lifecycle behavior is unobserved; the scenario remains a declared expectation for this candidate.",
          "status": "not-run"
        },
        {
          "duplicateInjectionDetected": null,
          "host": "claude-code",
          "injections": [],
          "observedInjectionCount": null,
          "reason": "Current Claude Code lifecycle behavior is unobserved; the scenario remains a declared expectation for this release.",
          "status": "not-run"
        }
      ],
      "id": "clear-routed",
      "lifecycleSource": "clear",
      "requestCaseIds": [
        "review-axiom-task-independent-audit-001"
      ],
      "sessionState": "cleared"
    },
    {
      "compactionMode": "manual",
      "expectationSource": "checked-in-hook-contract-not-host-observation",
      "expectedInjectionCount": 1,
      "hostObservations": [
        {
          "duplicateInjectionDetected": null,
          "host": "codex",
          "injections": [],
          "observedInjectionCount": null,
          "reason": "Current lifecycle behavior is unobserved; the scenario remains a declared expectation for this candidate.",
          "status": "not-run"
        },
        {
          "duplicateInjectionDetected": null,
          "host": "claude-code",
          "injections": [],
          "observedInjectionCount": null,
          "reason": "Current Claude Code lifecycle behavior is unobserved; the scenario remains a declared expectation for this release.",
          "status": "not-run"
        }
      ],
      "id": "manual-compaction-no-route",
      "lifecycleSource": "compact",
      "requestCaseIds": [
        "compaction-no-route-manual-001"
      ],
      "sessionState": "post-compaction"
    },
    {
      "compactionMode": "automatic",
      "expectationSource": "checked-in-hook-contract-not-host-observation",
      "expectedInjectionCount": 1,